20,20대의원,제17대 (비례대표) 한나라당 제18대 (서울 중구) 한나라당 제19대 (서울동작을) 새누리당 제20대(서울 동작을) 새누리당 제22대(서울 동작을) 국민의힘 ,나경원,羅卿瑗,null,null,1963년 12월 06일,null,서울,"· 서울여자고등학교 · 서울대학교 법과대학 (학사) · 서울대학교 대학원 법학 (석사) · 서울대학교 대학원 국제법 (박사과정수료) · 부산,인천지방법원 판사  · 서울행정법원 판사  · 한나라당 이회창대통령후보 여성특보(법률자문역)  · 변호사 나경원 법률사무소 변호사  · 한나라당 운영위원회 여성위원  · 한나라당 제17대총선 공천심사위원회 위원  · 한나라당 깨끗한선거위원회,장애인복지특별위원회 위원장  · 국회 연구단체 `장애아이 We Can` 회장  · 제17대 국회 운영위원회,법제사법위원회,예산결산특별위원회 위원   · 한나라당 원내부대표,대변인 · 제18대 국회 문화체육방송통신위원회 위원, 문화체육관광방송통신위원회 간사  · 한나라당 최고위원",천주교,세심,"특별감사패(한국연예제작자협회),대한민국환경문화대상 정치부문지도자대상",null,http://www.rokps.or.kr/profile/profile_view.asp?idx=2522
20,20대의원,제19대(비례대표) 새정치민주연합 제20대(서울 송파구병) 더불어민주당 제21대(서울 송파구병) 더불어민주당 제22대(서울 송파구병) 더불어민주당  ,남인순,南仁順,null,null,1958년 11월 05일,null,null,인일여자고등학교  수도여자사범대학 국어국문학  세종대학교 국어국문학 학사  성공회대학교 시민사회복지대학원 사회복지학 석사   인천여성노동자회 사무국장 인천여성노동자회 부회장 한국여성단체연합 사무국장 한국여성단체연합 사무처장 한국여성단체연합 사무총장 국회 범국민정치개혁협의회 위원 고령화및미래사회위원회 위원 국민고충처리위원회 비상임위원 사법제도개혁추진위원회 실무위원 한국여성단체연합 상임대표 시민사회단체연대회의 공동대표 저출산고령사회위원회 위원 국가인권위원회 성차별조정위원 중앙생활보장위원회 위원 KBS 이사 양형위원회 위원 민주평화통일자문회의 자문위원 교육과학부 법학교육위원회 위원 민족화해협력범국민협의회 공동상임의장 여성부 정책자문위원 내가꿈꾸는나라 공동대표 민주통합당 최고위원 내가꿈꾸는나라 지도위원,null,null,여성신문 미래를 이끌어갈 여성지도자상 한국여성단체연합 여성운동 15년 버팀목상 한겨레신문 한국의 미래를 열어갈 100인 국민훈장 동백장,null,http://www.rokps.or.kr/profile/profile_view.asp?idx=2789
20,20대의원,제17대국회의원(서울 마포갑) 통합민주당 제19대국회의원(서울 마포갑) 새정치민주연합 제20대국회의원(서울 마포갑) 더불어민주당 제21대국회의원(서울 마포구갑) 더불어민주당 ,노웅래,盧雄來,null,null,1957년 08월 03일,교하,서울 마포구 신공덕동,"서울 대성고등학교 졸업 중앙대학교 철학과 졸업 미국 미주리 주립대학(University of Missouri,Columbia)  신문방송대학원 객원연구원 동국대학교 언론정보대학원  매일경제신문 기자 MBC 보도국 사회부 차장(카메라 출동 팀장) (사회부/경제부/시사매거진 2580/대통령선거방송 기획단) MBC 기자회 총무 전국언론노동조합 부위원장 20개 단일노조 MBC 노동조합위원장 겸 서울지부 위원장 열린우리당 원내 공보부대표,국회 운영위원회 위원   제17대 국회 스카우트 의원연맹,보건복지위원회, 문화관광위원회위원 (사)선행칭찬운동본부 사회공헌위원장 열린우리당 대변인 중도개혁통합신당모임 수석부대표 민주당 대표 경선 추미애 후보 대변인 민주연대 창립준비위원회 공동위원장 민주당 창당준비위원회 대변인 충효예실천운동본부 고문 동국대학교 언론정보대학원 겸임교수 한국혈액암협회 공동이사 중국 우한대학교 국제정치대학원 객좌교수 민주당 마포갑 지역위원장","카톨릭, 배드민턴",MBC뉴스 노웅래 입니다!,"2004년 NGO모니터단,  문화일보, 내일신문, 주간한국  선정 국정감사 베스트 의원 2005년 시민일보 의정대상",null,http://www.rokps.or.kr/profile/profile_view.asp?idx=2330
20,20대의원,"제17대국회의원(비례대표) 민주노동당,진보신당 제19대국회의원(서울노원병) 통합진보당 제20대국회의원(경상남도 창원시성산구) 정의당 ",노회찬,魯會燦,null,null,1956년 08월 31일,강화,부산,"경기고등학교 고려대학교 정치외교학과 고려대학교 노동대학원 고위지도자과정 (수료) 고려대학교 노동대학원 석사과정  진보정치연합 대표 매일노동뉴스 발행인 인천지역민주노동자연맹 창립 노사관계개혁위원회 자문위원 국민승리21 기획위원장, 정책기획홍보위원장 민주노동당 부대표 민주노동당 권영길 대통령 후보 선거대책본부 본부장 민주노동당 사무총장, 권영길 대통령 후보 선거대책본부장 제17대 국회 법제사법위원회 위원 백기완 대통령 선거운동본부 조직위원장 한국노동정책 정보센터 대표 조선왕조실록 환수추진위원 매일노동뉴스 발행인 민주노동당 삼성불법정치자금 및 안기부불법도청특별대책위원회 위원장 민주노동당 민생특별위원회 위원장 진보신당 공동대표 진보신당 대표 진보정당건설 추진위원회 위원장 진보신당 상임고문 통합진보당 공동대변인 새진보정당추진회의 공동대표 진보정의당 공동대표",null,노동자와 노동절/석탑 87.88정치위기와 노동운동/거름 민주노조운동과 전노협/거름,"제13회 전태일문학상 특별상 (수상작, 선대본일기) 여성단체연합 호주제 폐지 감사패 광복회 친일재산환수법 통과 감사패 국회57주년 개원기념 우수의원외교 공로패 한글날 국경일 제정 범국민추진위원회 한글을 빛낸 큰별 조계종 조선왕조실록 환수 감사패",2018년 07월 23일,http://www.rokps.or.kr/profile/profile_view.asp?idx=2394
20,20대의원,제19대국회의원(비례대표) 새정치민주연합 제20대국회의원(충북 청주시흥덕구) 더불어민주당 제21대국회의원(충북청주시흥덕구) 더불어민주당,도종환,都鐘煥,null,null,1955년 09월 27일,null,null,충북대학교 국어교육학 학사  충북대학교 대학원 국어교육학 석사  충남대학교 대학원 문학 박사   시인 월간 충청리뷰 발행인 덕산중학교 교사 전국교직원노동조합 청주지부장 한국민족예술인총연합 충북지회 문학위원회 위원장 주성대학 문예창작과 겸임교수 민족문학작가회의 부이사장 제4대 한국간행물윤리위원회 위원 한국민족예술인총연합 부회장 한국작가회의 사무총장 민주통합당 공천심사위원회 위원 문화체육관광부 장관,null,"시인의 자장가, 흔들리며 피는 꽃, 슬픔의 뿌리, 담쟁이, 너없이 어찌 내게 향기 있으랴, 내가뽑은 나의 시, 사람의 마음에 꽃이 진다, 꽃은 젖어도 향기는 젖지 않는다, 세시에서 다섯시 사이, 흔들리지않고 피는 꽃이 어디 있으랴 등 85권",제8회 신동엽창작기금 제7회 민족예술상 제2회 KBS 바른 언어상 거창평화인권문학상 현대 문학부문 충북예술상 한국문화예술위원회 문학부문 올해의 예술상 제2회 제비꽃시인상 제21회 정지용문학상 제5회 윤동주상 문학부문 대상 제13회 백석문학상 제20회 공초문학상,null,http://www.rokps.or.kr/profile/profile_view.asp?idx=2770
20,20대의원,제20대(인천 남동구갑) 더불어민주당 제21대(인천 남동구갑) 더불어민주당 제22대(인천 남동구갑) 더불어민주당,맹성규,孟聖奎,null,null,1962년 05월 16일,null,null,신흥초등학교 상인천중학교 부평고등학교 고려대학교 행정학 학사 서울대학교 대학원 행정학 석사 캐나다 맥길대학교 대학원 법학 석사 한국항공대학교 대학원 법학 박사   제31회 행정고시 건설교통부 고속철도건설기획단 고속철도과장  건설교통부 예산담당관 건설교통부 육상교통기획과장 대통령비서실 행정관 국토해양부 항공안전정책관 주중국대한민국대사관 공사참사관 국토해양부 해양환경정책관 국토교통부 종합교통정책관 국토교통부 교통물류실 실장 제14대 강원도 경제부지사 국토교통부 제2차관 제20대 국회의원 (인천 남동구갑/더불어민주당) 제20대 국회 후반기 보건복지위원회 위원 더불어민주당 정책위원회 상임부의장   ,null,null,null,null,http://www.rokps.or.kr/profile/profile_view.asp?idx=3051
20,20대의원,제20대국회의원(비례대표 ) 더불어민주당 ,문미옥,文美玉,null,null,1968년 12월 20일,null,null,1993 ~ 1997  포항공과대학교 대학원 물리학과 박사 1991 ~ 1993  포항공과대학교 대학원 물리학과 석사 1987 ~ 1991  포항공과대학교 물리학과 학사   대통령비서실 과학기술보좌관 2018.12 ~ 2019.12  과학기술정보통신부 제1차관 2017.06 ~ 2018.12  대통령비서실 과학기술보좌관 2017.05  더불어민주당 당대표 비서실장 2017.02  더불어민주당 인재영입위원회 부위원장 2016.12  더불어민주당 AI대책특별위원회 위원 2016.12  더불어민주당 과학기술특별위원회 위원장 2016.10  더불어민주당 원자력안전대책특별위원회 간사 2016.06  더불어민주당 을지로위원회 위원 2016.06 ~ 2017.06  제20대 국회 전반기 미래창조과학방송통신위원회 위원 2016.06 ~ 2017.06  제20대 국회 전반기 여성가족위원회 위원 2016.05 ~ 2017.05  더불어민주당 원내부대표 2016.05 ~ 2017.06  제20대 국회의원 (비례대표/더불어민주당) 2016.01  더불어민주당 2013.05 ~ 2016.02  과학기술인협동조합지원센터 기획정책실장 2011.01 ~ 2016.02  한국여성과학기술인지원센터 기획정책실장 2003.09 ~ 2009.02  이화여자대학교 WISE거점센터 연구교수 2001  연세대학교 물리및응용물리사업단 연구교수 ,null,null,2016  더불어민주당 국정감사 우수의원 2016  원자력안전 의정활동 우수의원 2016  제1회 공공정책대상 입법부문 ,null,http://www.rokps.or.kr/profile/profile_view.asp?idx=3028
20,20대의원,제20대국회의원(비례대표) 새누리당,문진국,文鎭國,null,null,1949년 02월 01일,null,null,2020.03 ~  제20대 국회의원 (비례대표/미래한국당) 2020.02 ~ 2020.03  제20대 국회의원 (비례대표/미래통합당) 2018.07 ~   제20대 국회 후반기 환경노동위원회 위원 2017.02  자유한국당 노동위원회 위원장 2017.02 ~ 2020.02  제20대 국회의원 (비례대표/자유한국당) 2016.09 ~ 2017.02  새누리당 노동위원회 위원장 2016.06  제20대 국회 전반기 환경노동위원회 위원 2016.05 ~ 2017.02  제20대 국회의원 (비례대표/새누리당) ~ 2014.01  한국노동조합총연맹 위원장 전국택시노동조합연맹 위원장 한국노동조합총연맹 상임부위원장 ,null,null,2012  근로자의 날 정부포상 시상식 은탑산업훈장 ,null,http://www.rokps.or.kr/profile/profile_view.asp?idx=2913
20,20대의원,제14대 국회의원(경기 의정부) 새천년국민회의 제16대 국회의원(경기 의정부) 새천년민주당 제17대 국회의원(경기 의정부갑) 열린우리당 제18대 국회의원(경기 의정부갑) 민주당 제19대 국회의원(경기 의정부갑) 새정치민주연합 제20대 국회의원(경기 의정부갑) 더불어민주당 ,문희상,文喜相,null,正興,1945년 03월 03일,남평,경기 의정부,"·  경복고등학교 (서울) ·  서울대학교 법학과 (학사) ·  해군본부 법제담당관  ·  학교법인 경해학원 이사장  ·  숭문상가, 삼정식품 대표이사  ·  대한궁도협회 부회장  ·  평화민주당 총재비서실 차장  ·  민주당 대표비서실장  ·  대통령비서실 정무수석비서관(차관)  ·  국가안전기획부 기획조정실 실장  ·  국가안전기획부가 국가정보원으로 변경  ·  국가정보원 기획조정실 실장  ·  대한아이스하키협회 회장  ·  새천년민주당 최고위원  ·  제26대 대통령비서실 비서실장  ·  대통령 정치특별보좌관  ·  제17대 국회 정보위원회 위원장, 국회 국방위원회,통일외교통상위원회,정보위원회  위원  ·  한일의원연맹 회장  ·  열린우리당 의장  ·  제18대 국회 전반기 부의장  ·  제18대 국회 국방위원회,외교통상통일위원회 위원 ·  민주당 도시주거복지기획단 위원 ·  진보개혁모임 공동대표 ·  민주통합당 비상대책위원장",천주교 / 독서,"국민의 정부의 개혁방향과 과제, 생각을 바꾸면 세상이 바뀐다","황조근정훈장,  청조근정훈장  ",null,http://www.rokps.or.kr/profile/profile_view.asp?idx=2529
20,20대의원,제20대국회의원(인천광역시 연수구을) 새누리당 ,민경욱,閔庚旭,null,null,1963년 06월 17일,null,null,~ 1991  연세대학교 국제학대학원 ~ 1989  연세대학교 행정학 ~ 1982  송도고등학교 ~ 1979  동인천중학교 ~ 1976  신흥초등학교  2020.02  미래통합당 원내부대표 2020.02 ~  제20대 국회의원 (인천 연수구을/미래통합당) 2019.12 ~ 2020.02  자유한국당 원내부대표 2019.03 ~ 2019.08  자유한국당 대변인 2018.07 ~   제20대 국회 후반기 국토교통위원회 위원 2017.07  제20대 국회 전반기 과학기술정보방송통신위원회 위원 2017.07  자유한국당 홍보위원장 2017.02  자유한국당 원내부대표 2017.02 ~ 2020.02  제20대 국회의원 (인천 연수구을/자유한국당) 2016.12 ~ 2017.02  새누리당 원내부대표 2016.06  제20대 국회 전반기 예산결산특별위원회 위원 2016.06 ~ 2017.07  제20대 국회 전반기 미래창조과학방송통신위원회 위원 2016.06  제20대 국회 전반기 운영위원회 위원 2016.05 ~ 2017.02  제20대 국회의원 (인천 연수구을/새누리당) 2016.05  새누리당 원내대변인 2014.02 ~ 2015.10  대통령비서실 홍보수석실 대변인 2013.12 ~ 2014  KBS 보도국 문화부장 2007.07  KBS 보도국 정치부 데스크 2004.07 ~ 2007  KBS 워싱턴 특파원 2000.07  KBS 9시 뉴스 편집부 기자 1998.05  KBS 보도제작국 기자 1995.02  KBS 보도국 정치부 기자 KBS 기동취재부 기자 1994.02  KBS 보도국 사회부 기자 1993.02  KBS 청주방송총국 기자 1992.03  KBS 보도국 정치부 기자 1991.05  연합통신 외신부 촉탁위원 1990.07  공보처 해외공보관 외신부 전문위원 ,null,null,2012  제39회 한국방송대상 앵커상 2003  근로자의 날 KBS 사장 유공 표창 2002  KBS 바른언어 대상 1995  제22회 방송대상 보도기자부문 개인상 1995  KBS 사장 표창 1994  KBS 우수프로그램상 보도부문 금상 1994  한국기자협회 이달의기자상 ,null,http://www.rokps.or.kr/profile/profile_view.asp?idx=2980
20,20대의원,제17대국회의원(비례대표) 통합민주당 제19대국회의원(서울 동대문을) 새정치민주연합 제20대국회의원(서울 동대문을) 더불어민주당 ,민병두,閔丙두,null,null,1958년 06월 10일,null,강원도,"경기고등학교 성균관대학교 경상대학 무역학과 (학사) 문화일보 정치부 차장 문화일보 워싱턴특파원 차장 문화일보 편집국 정치부 부장직대 열린우리당 총선기획단 수석부단장 열린우리당 선거대책위원회 공동대변인 열린우리당 기획위원장 제17대 국회 전반기 문화관광위원회 위원 열린우리당 전자정당위원장 제17대 국회 교육위원회,예산결산특별위원회 위원 열린우리당 정책위원회 수석부의장 사랑의 장기기증운동본부 이사",천주교,null,null,null,http://www.rokps.or.kr/profile/profile_view.asp?idx=2368
20,20대의원,제19대(경남 김해갑) 새정치민주연합 제20대(경남 김해갑) 더불어민주당 제21대(경남 김해갑) 더불어민주당 제22대(경남 김해갑) 더불어민주당 ,민홍철,閔洪喆,null,null,1961년 04월 18일,null,null,김해고등학교  부산대학교 법학 학사  부산대학교 대학원 법학 석사  고등군사법원 군판사 대한민국 육군본부 법제과 과장 대한민국 육군본부 법무과 과장 대한민국 육군본부 고등검찰부 부장 대한민국 육군본부 법무차감 대한민국 육군본부 법무실 실장 대한민국 육군본부 법무감 국방부 인사소청위원회 위원장 제4대 고등군사법원 법원장 혁신과통합 추진위원회 위원 중앙행정심판위원회 위원,null,null,null,null,http://www.rokps.or.kr/profile/profile_view.asp?idx=2808
20,20대의원,제20대국회의원(비례대표 ) 더불어민주당 ,박경미,朴炅美,null,null,1965년 10월 15일,null,null,1990 ~ 1993  일리노이대학교 대학원 수학교육학 박사 1989 ~ 1990  일리노이대학교 대학원 수학 석사 1987 ~ 1989  서울대학교 대학원 수학교육학 석사과정 수료 1983 ~ 1987  서울대학교 수학교육학 학사  2020.03 ~  더불어민주당 서울특별시당 서초을 지역위원장 2019.05  더불어민주당 원내부대표 2018.07 ~  제20대 국회 후반기 교육위원회 위원 2018.07 ~  제20대 국회 후반기 운영위원회 위원 2018.07 ~ 2019.12  더불어민주당 서울특별시당 서초을 지역위원장 2018.05 ~ 2018.11  더불어민주당 원내대표단 원내대변인 2018.05  박원순 서울시장후보 캠프 수석대변인 2018.03 ~  더불어민주당 젠더폭력대책특별위원회 위원 2018.01 ~  더불어민주당 혁신성장추진위원회 위원 2017.12 ~ 2018.05  제20대 국회 4차 산업혁명 특별위원회 위원 2017.09 ~ 2018.03  더불어민주당 젠더폭력 태스크포스 위원 2017.08 ~ 2017.12  더불어민주당 정당발전위원회 간사 2017.05 ~ 2018.05  더불어민주당 원내대표단 소통부대표 2016.08 ~ 2017.05  더불어민주당 대변인 2016.07 ~ 2017.06  제20대 국회 미래일자리특별위원회 위원 2016.06 ~  국회 제4차산업혁명포럼 공동대표 2016.06  제20대 국회 전반기 여성가족위원회 위원 2016.06  제20대 국회 전반기 교육문화체육관광위원회 위원 2016.05 ~  제20대 국회의원 (비례대표/더불어민주당) 2006  SBS 뉴스 칼럼니스트 2006  동아일보 객원논설위원 2000  대한수학교육학회 이사 2000  홍익대학교 수학교육과 교수 1999 ~ 2000  충북대학교 수학교육과 교수 1998 ~ 2002  경제협력개발기구(OECD) PISA 수학전문위원 1998 ~ 1999  한국교육과정평가원 책임연구원 1995 ~ 1997  한국교육개발원 연구원  ,null,null,2020  법률소비자연맹 제20대 국회 4년 국회의원 헌정대상 2020  국회 2019년도 우수 국회의원 연구단체 (국회 4차산업혁명포럼) 2019  통일교육협의회 통일교육 의정활동 대상 2019  더불어민주당 국정감사 우수의원상 2019  국제장애인문화교류협회 제2회 대한민국 희망문화복지 10인 대상 중앙정치 청소년교육부문 2019  법률소비자연맹 제20대 국회 3차년도 국회의원 헌정대상 2019  국회를 빛낸 바른정치언어상 모범언어상 부문 2019  국회 2018년도 우수 국회의원연구단체 교육과학기술환경분야 (국회 4차산업혁명포럼) 2018  국정감사 NGO 모니터단 국리민복상 2018  더불어민주당 국정감사 우수의원상 2018  국정감사 친환경 베스트 의원상 2018  법률소비자연맹 국회의원 헌정대상 2018  국회사무처 입법 및 정책개발 우수 국회의원 2018  코리아 혁신 대상 의정 대상 2017  더불어민주당 국정감사 우수의원상 2017  제5회 대한민국 입법대상 2017  쿠키뉴스 국정감사 우수의원 2017  법률소비자연맹 국회의원 헌정대상 2016  국정감사 NGO 모니터단 국정감사 우수국회의원 2016  제2회 대한민국인성교육 대상 의정교육부문 ,null,http://www.rokps.or.kr/profile/profile_view.asp?idx=3002
20,20대의원,제19대국회의원(경기 수원정) 새정치민주연합 제20대국회의원(경기 수원정) 더불어민주당 제21대국회의원(경기수원시정) 더불어민주당,박광온,朴洸瑥,null,null,1957년 03월 26일,전남 해남,null,광주 동성중학교 졸업 광주 상업고등학교 졸업(현 동성고등학교) 고려대학교 사회학과 졸업 동국대학교 언론정보대학원 석사 MBC 도쿄특파원 MBC 보도국 통일외교부 부장 MBC 보도국 정치국제에디터 MBC 논설위원실 논설위원 MBC 보도국장 제18대 대통령선거 문재인대통령후보 선거대책위원회 대변인 민주당 홍보위원장 새정치민주연합 대변인 제19대 국회기획재정위원회 위원 ,천주교,null,null,null,http://www.rokps.or.kr/profile/profile_view.asp?idx=2889
20,20대의원,제19대국회의원(인천 남동구갑) 새정치민주연합 제20대국회의원(인천 남동구갑) 더불어민주당 ,박남춘,朴南春,null,null,1958년 07월 02일,null,null,"제물포고등학교  고려대학교 행정학 학사  웨일즈대학교 대학원 교통경제학 석사   해운항만청 유통과 과장 청와대 해양수산비서실 행정관 해양수산부 총무과 과장 국립해양조사원 원장 대통령직 인수위원회 전문위원 대통령비서실 국정상황실 실장 대통령비서실 인사제도 비서관, 인사관리 비서관 대통령비서실 인사수석 인천광역시 항만물류정책자문위원 제19대 국회 행정안전위원회 위원, 예산결산특별위원회 위원",null,null,한국문화예술유권자총연합회 제19대 국회 국정감사 최우수 국회의원 민주통합당 국정감사 우수 의원상 국정감사 NGO 모니터단 국정감사 우수 국회의원,null,http://www.rokps.or.kr/profile/profile_view.asp?idx=2786
20,20대의원,제19대(경남 진주시갑) 새누리당 제20대(경남 진주시갑) 새누리당 제21대(경남 진주시갑) 미래통합당 제22대(경남 진주시갑) 국민의힘,박대출,朴大出,null,null,1961년 03월 18일,null,null,진주남중학교  진주고등학교  연세대학교 정치외교학과 학사  연세대학교 행정대학원 외교안보 석사   서울신문 사회부 서울신문 산업부 서울신문 정치부 서울신문 공공정책부 부장 서울신문 정치부 부장 서울신문 정치부 선임기자 서울신문 논설위원 고용노동부 고용노동정책자문회의 위원 관세청 관세행정발전심의위원회 위원 고용노동부 사내하도급 근로조건 개선 서포터즈 부경대학교 겸임교수,null,null,null,null,http://www.rokps.or.kr/profile/profile_view.asp?idx=2806
20,20대의원,"제19대(충북 보은군옥천군영동군) 새누리당 제20대(충북 보은군옥천군영동군괴산군) 새누리당,자유한국당 제21대(충은 보은군옥천군영동군괴산군) 국민의힘 제22대(충은 보은군옥천군영동군괴산군) 국민의힘",박덕흠,朴德欽,null,null,1953년 10월 18일,null,충청북도 옥천,서울산업대학교 토목공학 학사 게르첸국립사범대학교 경영학 명예박사 서울산업대학교 경영학 명예박사 연세대학교 대학원 토목공학 석사 한양대학교 대학원 토목공학 박사 서울산업대학교 철도전문대학원 철도건설공학 박사과정 수료  원화코퍼레이션 대표이사 전문건설공제조합 운영위원장 대한건설정책연구원 이사장 한국건설산업품질연구원 이사장 세계도로협회 한국위원회 고문 한국지반환경공학회 이사 서울동부지검 범죄예방위원회 운영위원 서울산업대학교 발전후원회 회장 대한핸드볼협회 부회장 대한싸이클연맹 수석부회장 민주평화통일자문회의 자문위원 서울산업대학교 토목공학과 겸임교수 대한전문건설협회 중앙회 회장 중소기업 국민법제관,null,null,금탑산업훈장,null,http://www.rokps.or.kr/profile/profile_view.asp?idx=2755
